<?xml version="1.0" encoding="utf-8"?>

<p:personen xmlns:p="https://www.sandercokart.com/personen.xsd"
          xmlns:xsi="http://www.w3.org/2001/XMLSchema-instance"
          xsi:schemaLocation="https://www.sandercokart.com/personen.xsd personen.xsd">
    <persoon>
        <voornaam>Norval</voornaam>
        <achternaam>Prohaska</achternaam>
        <geslacht>man</geslacht>
        <geboortedatum>1998-04-25</geboortedatum>
        <lengte_in_cm>178</lengte_in_cm>
        <gewicht_in_kg>75</gewicht_in_kg>
        <haarkleur>rood</haarkleur>
    </persoon>
    <persoon>
        <voornaam>Lolita</voornaam>
        <achternaam>Schultz</achternaam>
        <geslacht>man</geslacht>
        <geboortedatum>1998-04-25</geboortedatum>
        <lengte_in_cm>178</lengte_in_cm>
        <gewicht_in_kg>75</gewicht_in_kg>
        <haarkleur>rood</haarkleur>
    </persoon>
    <persoon>
        <voornaam>Eleanore</voornaam>
        <achternaam>Krajcik</achternaam>
        <geslacht>man</geslacht>
        <geboortedatum>1998-04-25</geboortedatum>
        <lengte_in_cm>178</lengte_in_cm>
        <gewicht_in_kg>75</gewicht_in_kg>
        <haarkleur>rood</haarkleur>
    </persoon>
    <persoon>
        <voornaam>Addie</voornaam>
        <achternaam>Dicki</achternaam>
        <geslacht>man</geslacht>
        <geboortedatum>1998-04-25</geboortedatum>
        <lengte_in_cm>178</lengte_in_cm>
        <gewicht_in_kg>75</gewicht_in_kg>
        <haarkleur>rood</haarkleur>
    </persoon>
    <persoon>
        <voornaam>Alfreda</voornaam>
        <achternaam>Skiles</achternaam>
        <geslacht>man</geslacht>
        <geboortedatum>1998-04-25</geboortedatum>
        <lengte_in_cm>178</lengte_in_cm>
        <gewicht_in_kg>75</gewicht_in_kg>
        <haarkleur>rood</haarkleur>
    </persoon>
    <persoon>
        <voornaam>Lenny</voornaam>
        <achternaam>Collier</achternaam>
        <geslacht>man</geslacht>
        <geboortedatum>1998-04-25</geboortedatum>
        <lengte_in_cm>178</lengte_in_cm>
        <gewicht_in_kg>75</gewicht_in_kg>
        <haarkleur>rood</haarkleur>
    </persoon>
    <persoon>
        <voornaam>Henriette</voornaam>
        <achternaam>Lubowitz</achternaam>
        <geslacht>man</geslacht>
        <geboortedatum>1998-04-25</geboortedatum>
        <lengte_in_cm>178</lengte_in_cm>
        <gewicht_in_kg>75</gewicht_in_kg>
        <haarkleur>rood</haarkleur>
    </persoon>
    <persoon>
        <voornaam>Virgie</voornaam>
        <achternaam>Corwin</achternaam>
        <geslacht>man</geslacht>
        <geboortedatum>1998-04-25</geboortedatum>
        <lengte_in_cm>178</lengte_in_cm>
        <gewicht_in_kg>75</gewicht_in_kg>
        <haarkleur>rood</haarkleur>
    </persoon>
</p:personen>